{
  "case_id": "SP16-V021-RECONSTRUCTION-001",
  "standard": "СП 16.13330.2017",
  "action": "reconstruction_assessment",
  "section_18_applicability_confirmed": true,
  "defects_or_damage_present": true,
  "local_character_only": true,
  "restricts_normal_operation": false,
  "requires_monitoring_or_strengthening": false,
  "sudden_failure_or_global_instability_risk": false,
  "monitoring_program_confirmed": true,
  "smooth_load_transfer_to_strengthening_confirmed": true,
  "construction_stage_capacity_confirmed": true,
  "years_in_service": 30.0,
  "operating_conditions_worsened": false,
  "loads_increased": false,
  "main_member_strengthening_required": false,
  "factory_certificate_available": true,
  "sample_tests_completed": true,
  "executive_documentation_complete": true,
  "metal_quality_doubt_present": false,
  "steel_process": "open_hearth",
  "chemical_composition_tested": true,
  "tensile_properties_tested": true,
  "stress_strain_diagram_obtained": true,
  "impact_toughness_tested_if_required": true,
  "macro_microstructure_tested_if_required": true,
  "sulfur_percent": 0.03,
  "phosphorus_percent": 0.03,
  "manufacture_period": "after_1950",
  "specialized_research_institute_confirmed": false,
  "steel_production_method_identified": true,
  "steel_resistance_route": "after_1988_statistical_certificate",
  "normative_or_test_yield_n_mm2": 355.0,
  "normative_or_test_ultimate_n_mm2": 510.0,
  "weld_construction_period": "after_1972",
  "rivet_limit_state": "shear",
  "rivet_connection_group": "B",
  "rivet_steel": "St2_St3",
  "rivet_countersunk_or_semicountersunk_head": false,
  "rivet_diameter_mm": 20.0,
  "rivet_shear_planes": 2,
  "rivet_connected_thickness_sum_mm": 24.0,
  "rivet_working_condition_factor": 1.0,
  "brittle_steel_temperature_condition_triggered": false,
  "post_reconstruction_stress_not_above_existing_confirmed": true,
  "actual_geometry_supports_and_defects_in_model_confirmed": true,
  "mandatory_code_checks_pass": true,
  "serviceability_exceedance_blocks_operation": false,
  "slenderness_exceedance_acceptable_by_test_or_calculation": false,
  "additional_holes_and_welding_effects_included": true,
  "load_state_during_work_defined": true,
  "intermittent_flange_weld_used": true,
  "structure_group": 3,
  "design_temperature_c": -40.0,
  "environment": "mild",
  "combined_connection_type": "rivets_plus_friction",
  "existing_design_resistance_n_mm2": 300.0,
  "reinforcement_design_resistance_n_mm2": 330.0,
  "welding_used_for_strengthening": true,
  "initial_design_stress_n_mm2": 100.0,
  "axial_force_n": 500000.0,
  "strengthened_area_mm2": 3000.0,
  "working_condition_factor": 0.9,
  "moment_x_n_mm": 10000000.0,
  "inertia_x_mm4": 8000000.0,
  "point_y_mm": 100.0,
  "moment_y_n_mm": -2000000.0,
  "inertia_y_mm4": 4000000.0,
  "point_x_mm": 50.0,
  "phi_e": 0.8,
  "compressed_fiber_section_modulus_mm3": 300000.0,
  "axial_force_eccentricity_mm": 5.0,
  "initial_deflection_mm": 10.0,
  "euler_critical_force_n": 1000000.0,
  "initial_axial_force_n": 200000.0,
  "reinforcement_own_centroidal_inertia_sum_mm4": 1000.0,
  "original_inertia_mm4": 8000000.0,
  "strengthened_inertia_mm4": 12000000.0,
  "original_area_mm2": 2000.0,
  "average_weld_continuity_factor": 1.0,
  "effective_length_for_weld_deflection": 100.0,
  "weld_leg_cm": 0.8,
  "weld_terms": [
    {"n_i": 1.2, "y_i": 2.0},
    {"n_i": 0.8, "y_i": -1.0}
  ],
  "listed_deviation_only": true,
  "damage_caused_by_deviation_absent": true,
  "adverse_operating_change_excluded": true,
  "capacity_and_stiffness_justified": true,
  "fatigue_and_brittle_fracture_measures_confirmed": true
}
